<?xml version="1.0" encoding="UTF-8"?> 
<!DOCTYPE IES_LOS_REMEDIOS SYSTEM "IES_LOS_REMEDIOS.dtd">
<IES_LOS_REMEDIOS>
    <Asignaturas>
        <programacion>
            <Contenidos>
                <Tema1>
                    <lenguaje>JAVA</lenguaje>
                    <tipo>Practico</tipo>
                    <duracion>3 meses</duracion>
                    <descripcion>Dificultad alta</descripcion>
                    <nombre_profesor>Javier</nombre_profesor>
                </Tema1>
                <Tema2>
                    <lenguaje>PHYTON</lenguaje>
                    <tipo>Practico</tipo>
                    <duracion>2 meses</duracion>
                    <descripcion>Dificultad facil</descripcion>
                    <nombre_profesor>Javier</nombre_profesor>
                </Tema2>
                <Tema3>
                    <lenguaje>C++</lenguaje>
                    <tipo>Practico</tipo>
                    <duracion>4 meses</duracion>
                    <descripcion>Dificultad media</descripcion>
                    <nombre_profesor>Javier</nombre_profesor>
                </Tema3>
            </Contenidos>
        </programacion>
    </Asignaturas>
    <Asignaturas>
        <LenguajeMarcas>
            <Contenidos>
                <Tema1>
                    <lenguaje>XML</lenguaje>
                    <tipo>Practico</tipo>
                    <duracion>2 meses</duracion>
                    <descripcion>Dificultad media</descripcion>
                    <nombre_profesor>Ana</nombre_profesor>
                </Tema1>
                <Tema2>
                    <lenguaje>HTML</lenguaje>
                    <tipo>Teorico</tipo>
                    <duracion>4 meses</duracion>
                    <descripcion>Dificultad facil</descripcion>
                    <nombre_profesor>Ana</nombre_profesor>
                </Tema2>
                <Tema3>
                    <lenguaje>CSS</lenguaje>
                    <tipo>Teorico</tipo>
                    <duracion>3 meses</duracion>
                    <descripcion>Dificultad media</descripcion>
                    <nombre_profesor>Ana</nombre_profesor>
                </Tema3>
            </Contenidos>
        </LenguajeMarcas>
    </Asignaturas>
</IES_LOS_REMEDIOS>